{
  "baseUrl" : "http://localhost:8080/jira" ,
  "version" : "5.0-SNAPSHOT" ,
  "versionNumbers" : [
    5 ,
    0 ,
    0
  ] ,
  "buildNumber" : 582 ,
  "buildDate" : "2014-06-11T07:33:41.458+0000" ,
  "serverTime" : "2014-06-11T07:33:41.458+0000" ,
  "scmInfo" : "1f51473f5c7b75c1a69a0090f4832cdc5053702a" ,
  "buildPartnerName" : "Example Partner Co." ,
  "serverTitle" : "My Shiny New JIRA Server"
}